ID, Signifier, Statement
Rule1107,"Content of simple boundary reinstatement CSD","Content of simple boundary reinstatement CSD","A simple boundary reinstatement CSD must include all of the following:\u003Cbr/\u003E\n- a record of survey \u003Cbr/\u003E\n- a survey report\u003Cbr/\u003E\n- a dataset description that includes the survey purpose and the legal description of the parcel whose boundary is being reinstated\u003Cbr/\u003E\n- a statement of certification."
Rule1259,"CSD number for unit title development","CSD number for unit title development","A CSD for a unit title development that is deposited must retain the same CSD number as the previously deposited CSD that the CSD is substituted for."
Rule1497,"Data compliance","Data compliance","A CSD must comply with the cadastral survey rules when in providing data about the following:\u003Cbr/\u003E\n- a bearing\u003Cbr/\u003E\n- a distance\u003Cbr/\u003E\n- a reduced level\u003Cbr/\u003E\n- an area [quantity]."
Rule1142,"Definition of existing boundary point being marked","Definition of existing boundary point being marked","An existing boundary point that has a new mark being placed at the boundary point must be defined by survey."
Rule1143,"Definition of existing boundary point required to be marked","Definition of existing boundary point required to be marked","A boundary point that is included in an existing boundary that defines a new primary parcel must be defined by survey if any of the following are true:\u003Cbr/\u003E\n- the boundary point is subject to conflict\u003Cbr/\u003E\n- the boundary point is included in an existing boundary that is defined in an approved CSD where the definition of the existing boundary is insufficient for determining the compliance of the boundary with the applicable accuracy standard\u003Cbr/\u003E\n- the boundary point is included in an existing boundary that is only defined in a diagram on transfer \u003Cbr/\u003E\n- the boundary point is included in an existing boundary that defines a parcel from which limitation as to parcels is being uplifted \u003Cbr/\u003E\n- the boundary point is included in an existing boundary of a parcel from which the interim nature of the Hawkes Bay interim title is being removed\u003Cbr/\u003E\n- the boundary point is included in an existing boundary of a parcel that is subject to a claim for adverse possession\u003Cbr/\u003E\n- the boundary point is recorded in a Maori land CSD that is annotated "computed plan-areas and boundaries not defined by survey"\u003Cbr/\u003E\n- the boundary point was an unmarked boundary point that is included in a boundary defining a non-primary parcel."
Rule1140,"Definition of new boundary point","Definition of new boundary point","A new boundary point must be defined by survey."
Rule1139,"Definition of new irregular boundary","Definition of new irregular boundary","A new irregular boundary must be defined by survey."
Rule1137,"Definition of new water boundary","Definition of new water boundary","A new water boundary must be defined by survey."
Rule1141,"Definition of right line boundary replacing irregular, water or water centreline boundary","Definition of right line boundary replacing irregular, water or water centreline boundary","A new right-line boundary must be defined by survey if the right-line boundary converts a water or irregular boundary."
Rule1489,"Derivation of accurate relation of boundaries","Derivation of accurate relation of boundaries","A boundary may be considered a boundary accurately related to another boundary only if the boundary consists of boundary points that are all accurately related to each boundary point that is included in the other boundary."
Rule1470,"Derivation of accurately defined boundary","Derivation of accurately defined boundary","A boundary must be considered a boundary that is accurately defined only if each boundary point that is included in the boundary is an accurately defined boundary point."
Rule1144,"Derivation of affected by ground movement","Derivation of affected by ground movement","A boundary must be considered to be affected by ground movement if all of the following are true:\u003Cbr/\u003E\n- ground movement has distorted land crossed by the boundary in excess of the tolerance for the accuracy class relevant to the boundary\u003Cbr/\u003E\n- the boundary has not been subsequently defined by survey and recorded in an approved CSD.\u003Cbr/\u003E\n\u003Cbr/\u003E\n- is it better to rename the concept to 'boundary affected by ground movement'"
Rule1379,"Derivation of boundary point is subject to conflict","Derivation of boundary point is subject to conflict","A boundary point must be considered a boundary point subject to conflict if the boundary point is included in a boundary subject to conflict."
Rule1465,"Derivation of class A accurate relation of boundary points","Derivation of class A accurate relation of boundary points","A class A boundary point must be considered a boundary point accurately related to another class A boundary point only if the accuracy [relative] between the boundary points is class A accuracy."
Rule1378,"Derivation of class A boundary is subject to accuracy conflict with estate boundary","Derivation of class A boundary is subject to accuracy conflict with estate boundary","A class A boundary that is recorded in an approved CSD must be considered a boundary subject to conflict if all of the following are true:\u003Cbr/\u003E\n- the accuracy [relative] between a boundary point that is included in the boundary and another boundary point that is included in an estate boundary that coincides with the boundary is not class A\u003Cbr/\u003E\n- the conflict is not resolved in another approved CSD."
Rule1430,"Derivation of class A boundary is subject to position conflict with estate boundary","Derivation of class A boundary is subject to position conflict with estate boundary","A class A boundary recorded in an approved CSD must be considered a boundary subject to conflict if all of the following are true:\u003Cbr/\u003E\n- the accuracy [relative] between boundary points that are included in the boundary is not class A when other approved CSDs that record the boundary are taken into consideration\u003Cbr/\u003E\n- the conflict is not resolved in another approved CSD."
Rule1466,"Derivation of class B accurate relation of boundary points","Derivation of class B accurate relation of boundary points","A class B boundary point must be considered a boundary point accurately related to another boundary point only if the accuracy [relative] between the boundary points is class B accuracy when the other boundary point is any of:\u003Cbr/\u003E\n- a class A boundary point\u003Cbr/\u003E\n- a class B boundary point."
Rule1422,"Derivation of class B boundary is subject to conflict with estate boundary","Derivation of class B boundary is subject to conflict with estate boundary","A class B boundary must be considered a boundary subject to conflict if all of the following are true:\u003Cbr/\u003E\n- the boundary is an existing boundary\u003Cbr/\u003E\n- the accuracy [relative] between a boundary point that is included in the boundary and a boundary point that is included in an estate boundary that coincides with the boundary is not class B."
Rule1467,"Derivation of class C accurate relation of boundary points","Derivation of class C accurate relation of boundary points","A class C boundary point must be considered a boundary point accurately related to another boundary point only if the accuracy [relative] between the boundary points is class C accuracy when the other boundary point is any of:\u003Cbr/\u003E\n- a class A boundary point\u003Cbr/\u003E\n- a class B boundary point\u003Cbr/\u003E\n- a class C boundary point."
Rule1421,"Derivation of class C boundary is subject to conflict with estate boundary","Derivation of class C boundary is subject to conflict with estate boundary","A class C boundary must be considered a boundary subject to conflict if all of the following are true:\u003Cbr/\u003E\n- the boundary is an existing boundary\u003Cbr/\u003E\n- the accuracy [relative] between a boundary point that is included in the boundary and a boundary point that is included in an estate boundary that coincides with the boundary is not class C."
Rule1468,"Derivation of class D accurate relation of boundary points","Derivation of class D accurate relation of boundary points","A class D boundary point must be considered a boundary point accurately related to another boundary point only if the accuracy [relative] between the boundary points is class D accuracy."
Rule1423,"Derivation of class D boundary is subject to conflict with estate boundary","Derivation of class D boundary is subject to conflict with estate boundary","A class D boundary must be considered a boundary subject to conflict if all of the following are true:\u003Cbr/\u003E\n- the boundary is an existing boundary\u003Cbr/\u003E\n- the accuracy [relative] between a boundary point that is included in the boundary and a boundary point that is included in an estate boundary that coincides with the boundary is not class D."
Rule1003,"Derivation of Complete CSD 1","Derivation of Complete CSD 1","A CSD must be considered a complete CSD only if the CSD consists of a record of survey."
Rule1004,"Derivation of Complete CSD 2","Derivation of Complete CSD 2","A CSD for a cadastral survey that creates a parcel must be considered a complete CSD only if the CSD consists of a title plan."
Rule1092,"Derivation of Complete CSD 3","Derivation of Complete CSD 3","A CSD must be considered a complete CSD only if the CSD consists of a dataset description."
Rule1096,"Derivation of Complete CSD 4","Derivation of Complete CSD 4","A CSD must be considered a complete CSD only if the CSD consists of a survey report."
Rule1429,"Derivation of Complete CSD 5","Derivation of Complete CSD 5","A CSD must be considered a complete CSD only if the CSD consists of all relevant field information related to that CSD in a form that ensures permanent usability."
Rule1097,"Derivation of Complete CSD 6","Derivation of Complete CSD 6","A CSD must be considered a complete CSD only if the CSD includes an accurate record of the position of each new water boundary that is in that CSD."
Rule1493,"Derivation of Complete CSD 7","Derivation of Complete CSD 7","A CSD must be considered a complete CSD only if the CSD includes a certification of survey plan approval if the CSD is for a Crown subdivision."
Rule1093,"Derivation of dataset description 1","Derivation of dataset description 1","A dataset description included in a CSD must have a parcel ID for each primary parcel that is created by the cadastral survey."
Rule1094,"Derivation of dataset description 2","Derivation of dataset description 2","A dataset description included in a CSD must have the survey purpose if the CSD is a land transfer CSD."
Rule1095,"Derivation of dataset description 3","Derivation of dataset description 3","A dataset description included in a CSD must have a parcel ID for each underlying parcel in that CSD if the CSD is a land transfer CSD."
Rule1172,"Derivation of extinguished parcel","Derivation of extinguished parcel","An existing parcel must be considered an extinguished parcel if any of the following is true:\u003Cbr/\u003E\n- the existing parcel has been replaced by at least one new parcel\u003Cbr/\u003E\n- the existing parcel has expired."
Rule1405,"Derivation of referenced boundary mark","Derivation of referenced boundary mark","A boundary mark must be considered a referenced boundary mark if the boundary mark is included in a boundary that defines a parcel being surveyed."
Rule1404,"Derivation of referenced boundary point","Derivation of referenced boundary point","A boundary point that is defined by survey and is included in a boundary that defines a primary parcel must be considered a referenced boundary point if the boundary is not a water or irregular boundary."
Rule1495,"Derivation of referenced by","Derivation of referenced by","A point must be considered a point that is referenced by a permanent reference mark only if at least one series of vectors connects the point and the permanent reference mark."
Rule1406,"Derivation of referenced height-limited boundary point","Derivation of referenced height-limited boundary point","A new boundary point must be considered a referenced height-limited boundary point if the boundary point is included in a height limited boundary that defines a primary parcel."
Rule1435,"Derivation of right area non-primary parcel","Derivation of right area non-primary parcel","Only a right area that is in the common marine and coastal area may be a right area that is a category of non-primary parcel"
Rule1399,"Destroyed or not found survey mark","Destroyed or not found survey mark","A record of survey must identify whether a survey mark is any of the following:\u003Cbr/\u003E\n- searched for and not found\u003Cbr/\u003E\n- destroyed."
Rule1243,"Disturbed boundary mark removed 1","Disturbed boundary mark removed 1","A disturbed survey mark may be driven below the surface if the survey mark is categorized only as a boundary mark."
Rule1027,"Disturbed boundary mark removed 2","Disturbed boundary mark removed 2","A disturbed survey mark may be removed if the survey mark is categorized only as a boundary mark."
Rule1297,"Disturbed survey mark","Disturbed survey mark","A survey mark must be considered a new survey mark the same survey mark type as the old survey mark if the survey mark is a disturbed survey mark."
Rule1376,"Easement or covenant accuracy between boundary point and adopted CSNM","Easement or covenant accuracy between boundary point and adopted CSNM","The accuracy [relative] between a boundary point that defines a boundary of a non-primary parcel and a cadastral survey network mark must be less than or equal to 0.6 m if all of the following are true:\u003Cbr/\u003E\n- the non-primary parcel is an easement parcel or a covenant parcel\u003Cbr/\u003E\n- the boundary is not a class D boundary."
Rule1375,"Easement or covenant connected by vectors to CSNM","Easement or covenant connected by vectors to CSNM","A boundary point that defines a boundary of a non-primary parcel must be connected by vectors to at least 1 cadastral survey network mark if all of the following are true:\u003Cbr/\u003E\n- the non-primary parcel is an easement parcel or a covenant parcel\u003Cbr/\u003E\n- the boundary is not a class D boundary."
Rule1041,"Equipment type","Equipment type","A record of survey must include the type of equipment used in the field measurement of each measured vector in the cadastral survey."
Rule1038,"Existing boundary defining new large rural parcel being accepted","Existing boundary defining new large rural parcel being accepted","An existing boundary that defines a new large rural parcel may be an accepted boundary only if any other new parcel defined by the boundary is a new large rural parcel."
Rule1061,"Existing irregular boundary on a new primary parcel","Existing irregular boundary on a new primary parcel","A new primary parcel may be defined by an existing irregular boundary only if any of the following are true:\u003Cbr/\u003E\n- the irregular boundary is an accepted boundary\u003Cbr/\u003E\n- the primary parcel is a majority successor parcel\u003Cbr/\u003E\n- the primary parcel is a large rural parcel\u003Cbr/\u003E\n- the irregular boundary was previously a water boundary."
Rule1352,"Existing irregular boundary on a parcel","Existing irregular boundary on a parcel","An existing irregular boundary that defines a parcel must be converted to right-line boundaries."
Rule1308,"Existing survey mark","Existing survey mark","The name of an existing survey mark that is not unique in a CSD must be made unique by adding a unique numeric identifier within round brackets before the CSD number."
Rule1257,"Existing unit and lease boundaries accepted","Existing unit and lease boundaries accepted","The boundaries of an existing unit parcel may be accepted only if all of the following are true:\u003Cbr/\u003E\n- the existing parcel is included in an approved CSD\u003Cbr/\u003E\n- no change is made to any parcel boundary\u003Cbr/\u003E\n- no change is made to the record of title of the parcel."
Rule1266,"Existing unit and lease boundaries accepted 2","Existing unit and lease boundaries accepted 2","The boundaries of an existing company lease parcel may be accepted only if all of the following are true:\u003Cbr/\u003E\n- the existing parcel is included in an approved CSD\u003Cbr/\u003E\n- no change is made to any parcel boundary\u003Cbr/\u003E\n- no change is made to the record of title of the parcel."
Rule1267,"Existing unit and lease boundaries accepted 3","Existing unit and lease boundaries accepted 3","The boundaries of an existing cross lease parcel may be accepted only if all of the following are true:\u003Cbr/\u003E\n- the existing parcel is included in an approved CSD\u003Cbr/\u003E\n- no change is made to any parcel boundary\u003Cbr/\u003E\n- no change is made to the record of title of the parcel."
Rule1258,"Existing unit and lease boundary parcel appellation","Existing unit and lease boundary parcel appellation","The existing parcel appellation of all of the following must be retained if the boundaries of the parcel are accepted:\u003Cbr/\u003E\n- an existing unit parcel\u003Cbr/\u003E\n- an existing company lease parcel \u003Cbr/\u003E\n- an existing cross lease parcel."
Rule1102,"Font size for text","Font size for text","The font size for an appellation and area must be significantly larger than the font size used for vectors, dimensions, descriptions, and survey mark information."
Rule1065,"Former water boundary","Former water boundary","An existing water boundary for which the margin of the water body has moved by processes other than accretion or erosion must be adopted as an irregular boundary or converted to one or more right-line boundaries."
Rule1071,"Height limited boundary 1","Height limited boundary 1","A height limited boundary must be a surface that is mathematically described if any boundary point that is included in the boundary has a reduced level."
Rule1074,"Height limited boundary 2","Height limited boundary 2","A height limited boundary must be a surface of a water body or the bed of a water body if no boundary point that is included in the boundary has a reduced level."
Rule1249,"Height limited boundary point referenced to PRM","Height limited boundary point referenced to PRM","A referenced height-limited boundary point must be referenced by a permanent reference mark that has a reduced level."
Rule1280,"Height limited boundary points on unit development","Height limited boundary points on unit development","The reduced levels in a unit title development must be expressed in terms of the previously deposited CSD for that unit title development."
Rule1281,"Height limited boundary points on unit development 2","Height limited boundary points on unit development 2","A vertical control mark that is less than or equal to 1,000 m from a new height limited boundary point in a unit title development must be provided with a reduced level in terms of the unit title development if all of the following are true:\u003Cbr/\u003E\n- there is at least one vertical control mark less than or equal to 1,000 m from the boundary point\u003Cbr/\u003E\n- an unofficial datum is used in a cadastral survey for the unit title development."
Rule1293,"Height limited boundary points on unit development 3","Height limited boundary points on unit development 3","A vertical control mark that is more than 1,000 m from a new height limited boundary point in a unit title development must be provided with a reduced level in terms of a unit title development if all of the following are true:\u003Cbr/\u003E\n- there are no vertical control marks that are less than or equal to 1,000 m from the boundary point\u003Cbr/\u003E\n- an unofficial datum is used in a cadastral survey for the unit title development."
Rule1125,"Horizontal accuracy between adopted Cadastral Survey Network Mark and non-boundary mark 1","Horizontal accuracy between adopted Cadastral Survey Network Mark and non-boundary mark 1","The accuracy [relative] between an adopted cadastral survey network mark and each non-boundary mark must not exceed 0.025 + (0.00015 * the horizontal distance between the adopted cadastral survey network mark and the non-boundary mark)."
Rule1127,"Horizontal accuracy between adopted Cadastral Survey Network Mark and non-boundary mark 2","Horizontal accuracy between adopted Cadastral Survey Network Mark and non-boundary mark 2","The accuracy [relative] between an adopted cadastral survey network mark and each non-boundary mark must not exceed 0.2 m horizontal."
Rule1126,"Horizontal accuracy between non-boundary marks 1","Horizontal accuracy between non-boundary marks 1","The accuracy [relative] between a non-boundary mark and each other non-boundary mark must not exceed 0.025 + (0.00005 * the horizontal distance between the non-boundary marks)."
Rule1302,"Horizontal accuracy between non-boundary marks 2","Horizontal accuracy between non-boundary marks 2","The accuracy [relative] between a non-boundary mark and each other non-boundary mark must not exceed 0.2 m horizontal."
Rule1407,"Horizontal Class A accuracy of boundary referencing","Horizontal Class A accuracy of boundary referencing","A class A boundary point that is a referenced point must be considered an accurately defined boundary point only if the accuracy [relative] between the class A boundary point and each non-boundary mark that is less than or equal to 150 m from the class A boundary point does not exceed 0.03 m horizontal."
Rule1409,"Horizontal Class B accuracy of boundary referencing","Horizontal Class B accuracy of boundary referencing","A class B boundary point that is a referenced point must be considered an accurately defined boundary point only if the accuracy [relative] between the class B boundary point and each non-boundary mark that is less than or equal to 500 m from the class B boundary point does not exceed 0.20 m horizontal."
Rule1411,"Horizontal Class C accuracy of boundary referencing","Horizontal Class C accuracy of boundary referencing","A class C boundary point that is a referenced point must be considered an accurately defined boundary point only if the accuracy [relative] between the class C boundary point and each non-boundary mark that is less than or equal to 1000 m from the class C boundary point does not exceed 0.60 m horizontal."
Rule1483,"Horizontal connection for non-primary parcels over water 1","Horizontal connection for non-primary parcels over water 1","A boundary point that is included in a boundary that defines a non-primary parcel must be connected by at least one vector to a cadastral survey network mark if the underlying parcel is a common marine and coastal area."
Rule1484,"Horizontal connection for non-primary parcels over water 2","Horizontal connection for non-primary parcels over water 2","An accuracy [relative] between a boundary point that is included in a boundary that defines a non-primary parcel and an adopted cadastral survey network mark must not exceed 0.60 m horizontal if the underlying parcel is a common marine and coastal area."
Rule1057,"Horizontal extent of a primary parcel","Horizontal extent of a primary parcel","The horizontal extent of a primary parcel must be defined by only the following:\u003Cbr/\u003E\n- a right-line boundary\u003Cbr/\u003E\n- an arc boundary\u003Cbr/\u003E\n- a water or irregular boundary."
Rule1035,"Horizontal extent of non-primary parcel","Horizontal extent of non-primary parcel","The horizontal extent of a non-primary parcel must be defined by only the following:\u003Cbr/\u003E\n- a right-line boundary\u003Cbr/\u003E\n- an arc boundary\u003Cbr/\u003E\n- a water or irregular boundary \u003Cbr/\u003E\n- a permanent structure boundary."
Rule1400,"Impracticable to mark boundary point record","Impracticable to mark boundary point record","A record of survey must identify a boundary point as impracticable to mark if it is impracticable to mark the boundary point."
Rule1310,"Information in Record of Survey 1","Information in Record of Survey 1","A record of survey must include all of the following:\u003Cbr/\u003E\n- a survey diagram\u003Cbr/\u003E\n- a list of all CSDs used in the survey\u003Cbr/\u003E\n- the identity of any parcel that is to be extinguished.\u003Cbr/\u003E\n- the dataset description\u003Cbr/\u003E\n- a statement of certification."
Rule1311,"Information in Record of Survey 2","Information in Record of Survey 2","A record of survey must include the land district of each CSD used in the survey if the CSD number of each CSD is not unique."
Rule1312,"Information in Record of Survey 3","Information in Record of Survey 3","A record of survey must include the date the survey was completed if a field measurement is made in the survey."
Rule1313,"Information in Record of Survey 4","Information in Record of Survey 4","A record of survey must include all of the following on every sheet of the record of survey:\u003Cbr/\u003E\n- the CSD number\u003Cbr/\u003E\n- the sheet number\u003Cbr/\u003E\n- the total number of sheets in the record of survey."
Rule1255,"Irregular boundary not converted","Irregular boundary not converted","An existing irregular boundary need not be converted to right-line boundaries if the parcels defined by the boundary are non-primary parcels."
Rule1254,"Irregular non-primary parcel boundary","Irregular non-primary parcel boundary","A boundary that defines a non-primary parcel must be an irregular boundary if the boundary coincides with an irregular boundary that defines a movable marginal strip or defines an esplanade strip."
