ID, Signifier, Statement
Rule1452,"!!!!Survey diagram parcel polygon information","!!!!Survey diagram parcel polygon information","A survey diagram must include a representation of each parcel in the CSD as a polygon or polyhedron if the parcel is not an existing centre-line easement for which all of the following are true:\u003Cbr/\u003E\n- the width of the centre-line easement is unknown\u003Cbr/\u003E\n- the width of the centre-line easement is accepted within a large rural parcel with accepted boundaries."
Rule1063,"A water boundary may be adopted","A water boundary may be adopted","An existing water boundary may be adopted when the margin of the water body has moved as a result of accretion only if all of the following are true:\u003Cbr/\u003E\n- the margin of the water body has not also moved as a result of erosion or the water boundary is an accepted boundary\u003Cbr/\u003E\n- the CSD does not have a survey purpose that is a claim for accretion."
Rule1068,"A water centreline boundary may be adopted","A water centreline boundary may be adopted","An existing irregular boundary that followed the centre-line of a water body may be adopted only if the existing irregular boundary is adopted as a water centre-line boundary."
Rule1393,"A water centreline boundary use","A water centreline boundary use","A new boundary must not be a water centre-line boundary."
Rule1031,"Acceptance of existing boundary 2","Acceptance of existing boundary 2","A boundary that defines a primary parcel must not be an accepted boundary if there is a risk of the boundary encroaching on another parcel."
Rule1032,"Acceptance of existing boundary 3","Acceptance of existing boundary 3","A boundary that defines a new primary parcel must not be an accepted boundary if the primary parcel is not a majority successor parcel."
Rule1033,"Acceptance of existing boundary 4","Acceptance of existing boundary 4","A boundary that defines a primary parcel must not be an accepted boundary if all of the following are false:\u003Cbr/\u003E\n- the boundary is a right-line boundary that does not have a boundary bearing or have a boundary distance in an approved CSD\u003Cbr/\u003E\n- the boundary has a boundary bearing that is a magnetic bearing and the reorientation of the boundary bearing cannot be determined without measurement\u003Cbr/\u003E\n- the boundary defines a balance parcel that is included in a title that is to remain limited as to parcels and accuracy [relative] between boundary points included in the boundary does not meet class C accuracy\u003Cbr/\u003E\n- the boundary defines a balance parcel that is included in a title that is to remain a Hawkes Bay interim title and accuracy [relative] between boundary points included in the boundary does not meet class C accuracy\u003Cbr/\u003E\n- the boundary is a water boundary or a water centre-line boundary that defines a balance parcel that is included in a title that is to remain limited as to parcels \u003Cbr/\u003E\n- the boundary is a water boundary or a water centre-line boundary that defines a balance parcel that is included in a title that is to remain Hawkes bay interim title\u003Cbr/\u003E\n- the boundary is an existing irregular boundary."
Rule1040,"Acceptance of existing boundary point","Acceptance of existing boundary point","A boundary point must be accepted if the boundary point is included in a boundary that is an accepted boundary."
Rule1333,"Acceptance of non-primary boundaries","Acceptance of non-primary boundaries","A boundary that defines a non-primary parcel may be an accepted boundary only if the boundary is within a large rural parcel defined by accepted boundaries."
Rule1286,"Accepting existing water boundaries","Accepting existing water boundaries","A new water boundary that defines a non-primary parcel coinciding with an existing water boundary that defines a primary parcel must be considered an accepted water boundary only if the non-primary parcel is over any of the following bodies of water:\u003Cbr/\u003E\n- a stream\u003Cbr/\u003E\n- a river\u003Cbr/\u003E\n- a lake\u003Cbr/\u003E\n- a common marine and coastal area."
Rule1072,"Accounting for erosion when water boundary not accepted","Accounting for erosion when water boundary not accepted","An existing water boundary must be defined by survey if all of the following are true:\u003Cbr/\u003E\n- the margin of the water body has moved as a result of erosion\u003Cbr/\u003E\n- the water boundary is not an accepted boundary."
Rule1083,"Accretion, stream bed and adverse possesion area","Accretion, stream bed and adverse possesion area","An area [quantity] must be assigned to a portion of land that has any of the following survey purpose:\u003Cbr/\u003E\n- a claim for accretion\u003Cbr/\u003E\n- a claim for a dry stream bed \u003Cbr/\u003E\n- a claim for adverse possession."
Rule1458,"Accuracy [positional] for right line boundary intersecting a water or irregular boundary 1","Accuracy [positional] for right line boundary intersecting a water or irregular boundary 1","The boundary bearing of a right line boundary that intersects a water or irregular boundary must be defined to a level of accuracy [positional] that is consistent with the accuracy class of the right line boundary."
Rule1459,"Accuracy [positional] for right line boundary intersecting a water or irregular boundary 2","Accuracy [positional] for right line boundary intersecting a water or irregular boundary 2","The boundary distance of a right line boundary that intersects a water or irregular boundary must be defined to a level of accuracy [positional] that is consistent with the accuracy [positional] of the water or irregular boundary."
Rule1473,"Accuracy [positional] for right line boundary intersecting an accepted water boundary 1","Accuracy [positional] for right line boundary intersecting an accepted water boundary 1","The boundary bearing of a right line boundary that intersects an accepted water boundary must be defined to a level of accuracy [positional] that is consistent with the accuracy class of the right line boundary."
Rule1474,"Accuracy [positional] for right line boundary intersecting an accepted water boundary 2","Accuracy [positional] for right line boundary intersecting an accepted water boundary 2","The boundary distance of a right line boundary that intersects an accepted water boundary must be defined to a level of accuracy [positional] that is consistent with the accuracy [positional] of the water boundary."
Rule1475,"Accuracy [positional] for right line boundary intersecting an offset water boundary 1","Accuracy [positional] for right line boundary intersecting an offset water boundary 1","A boundary bearing of a right line boundary that intersects an offset water boundary must meet a level of accuracy [positional] that is consistent with the accuracy class of the right line boundary."
Rule1476,"Accuracy [positional] for right line boundary intersecting an offset water boundary 2","Accuracy [positional] for right line boundary intersecting an offset water boundary 2","The boundary distance of a right line boundary that intersects an offset water boundary need not be defined."
Rule1088,"Accuracy sufficient to avoid overlap","Accuracy sufficient to avoid overlap","A boundary point that is included in a new boundary must be considered a boundary point that is accurately defined only if the accuracy [relative] between the boundary point and each other boundary point that is included in another boundary is less than the horizontal distance and less than the slope distance between the boundary points."
Rule1471,"Accurate definition of boundaries","Accurate definition of boundaries","A boundary must be accurately defined."
Rule1488,"Accurate relation of non-primary parcel boundaries to underlying parcel boundaries","Accurate relation of non-primary parcel boundaries to underlying parcel boundaries","A boundary that defines a non-primary parcel must be accurately related to each boundary that defines an underlying parcel if the underlying parcel is not created by the same cadastral survey as the non-primary parcel."
Rule1184,"Adopted mark not used as PRM","Adopted mark not used as PRM","An adopted mark must not be used as a permanent reference mark."
Rule1498,"Adpoted information from source","Adpoted information from source","An adopted piece of information must be copied from the source of the information without change if the information is not any of the following:\u003Cbr/\u003E\n- the conversion of units of measure\u003Cbr/\u003E\n- a bearing adjustment."
Rule1442,"Ambiguity and overlap of water or irregular boundaries","Ambiguity and overlap of water or irregular boundaries","A water or irregular boundary that is not an accepted boundary must have its position determined to a level of accuracy [positional] that prevents a parcel defined by the boundary overlapping another parcel."
Rule1005,"Approval of CSD 1","Approval of CSD 1","A CSD may be an approved CSD only if the CSD is a complete CSD."
Rule1108,"Balance parcel constraint","Balance parcel constraint","A balance parcel may be derived only from any of the following primary parcels: \u003Cbr/\u003E\n- a railway parcel that is not in a record of title\u003Cbr/\u003E\n- a road parcel\u003Cbr/\u003E\n- a fixed marginal strip\u003Cbr/\u003E\n- the bed of a lake\u003Cbr/\u003E\n- the bed of a river\u003Cbr/\u003E\n- the bed of a stream\u003Cbr/\u003E\n- the bed of the sea\u003Cbr/\u003E\n- an access way that is not in a record of title\u003Cbr/\u003E\n- a service lane that is not in a record of title."
Rule1416,"Boundary class exceptions","Boundary class exceptions","A water or irregular boundary must not be considered any of the following:\u003Cbr/\u003E\n- a class A boundary\u003Cbr/\u003E\n- a class B boundary\u003Cbr/\u003E\n- a class C boundary\u003Cbr/\u003E\n- a class D boundary."
Rule1332,"Boundary coincides boundary","Boundary coincides boundary","A boundary must be considered a boundary that is coincident with another boundary if the boundary is intended to lie exactly on top of the other boundary."
Rule1353,"Boundary converts boundary","Boundary converts boundary","A boundary must be considered a boundary that is converted if the boundary is replaced by another boundary that is not of the same boundary form."
Rule1037,"Boundary for balance or residual parcel being accepted","Boundary for balance or residual parcel being accepted","An existing boundary that defines a balance parcel or defines a residue parcel may be an accepted boundary only if there is no other new parcel defined by the boundary."
Rule1354,"Boundary intersects boundary","Boundary intersects boundary","A boundary must be considered a boundary that intersects another boundary if the boundaries consist of the same boundary point."
Rule1251,"Boundary mark on existing boundary point 1","Boundary mark on existing boundary point 1","A mark must be placed at a boundary point that is included in an existing boundary that defines a new primary parcel if it is practicable for the mark to be placed at the boundary point and any of the following is true:\u003Cbr/\u003E\n- the boundary point is subject to conflict\u003Cbr/\u003E\n- the definition of the boundary in an approved CSD is not sufficient to determine the compliance of the boundary with the applicable accuracy standard\u003Cbr/\u003E\n- the boundary is only defined in a diagram on transfer\u003Cbr/\u003E\n- the boundary defines a parcel from which limitation as to parcels is being uplifted\u003Cbr/\u003E\n- the parcel is subject to a claim for adverse possession\u003Cbr/\u003E\n- the boundary point is recorded in a Maori Land CSD that is annotated "computed plan – areas and boundaries not defined by survey" \u003Cbr/\u003E\n- the boundary is recorded in a Maori Land CSD that is annotated "computed plan – areas and boundaries not defined by survey"\u003Cbr/\u003E\n- the boundary point is an unmarked boundary point that was included in boundaries that defined only non-primary parcels."
Rule1420,"Boundary mark on existing boundary point 2","Boundary mark on existing boundary point 2","A mark must be placed at a boundary point that is included in an existing boundary that defines a new primary parcel if all of the following are true:\u003Cbr/\u003E\n- it is practicable for the mark to be placed at the boundary point\u003Cbr/\u003E\n- the boundary defines a parcel that is part of a Hawkes Bay interim title\u003Cbr/\u003E\n- one of the survey purposes is an application to make the Hawkes Bay interim title conclusive."
Rule1240,"Boundary mark on new boundary point","Boundary mark on new boundary point","A mark need not be placed at a new boundary point that is included in a boundary that defines a new primary parcel if any the following are true:\u003Cbr/\u003E\n- all parcels that are adjacent to the boundary point are new parcels intended to be owned by the Crown\u003Cbr/\u003E\n- all parcels that are adjacent to the boundary point are new parcels intended to be owned by the same territorial authority\u003Cbr/\u003E\n- the Maori Land Court does not require a mark to be placed at a boundary point that is included in the boundary\u003Cbr/\u003E\n- all parcels that are adjacent to the boundary point are or will be held in common ownership\u003Cbr/\u003E\n- the parcels on each side of the boundary are or will be subject to a reciprocal right of way\u003Cbr/\u003E\n- the terrain, ground cover, or protected vegetation make it unlikely that the boundary point will need to be physically located\u003Cbr/\u003E\n- the boundary point results from an existing water or irregular boundary being converted to a right-line boundary that is a class B boundary \u003Cbr/\u003E\n- the boundary point coincides with a water boundary\u003Cbr/\u003E\n- the boundary point coincides with a water centre-line boundary\u003Cbr/\u003E\n- it is not practicable for a mark to be placed at the boundary point."
Rule1252,"Boundary mark on parcel that is limited as to parcels","Boundary mark on parcel that is limited as to parcels","A boundary mark must not be placed at a boundary point that is included in a boundary that defines a parcel that is limited as to parcels."
Rule1177,"Boundary mark reference to permanent reference mark","Boundary mark reference to permanent reference mark","A referenced boundary mark must be referenced by a permanent reference mark."
Rule1434,"Boundary point coincides boundary","Boundary point coincides boundary","A boundary point must be considered a boundary point that is coincident with a boundary if the boundary point is intended to lie on the line of the boundary."
Rule1250,"Boundary point reference to permanent reference mark","Boundary point reference to permanent reference mark","A referenced boundary point must be referenced by a permanent reference mark."
Rule1178,"Boundary point reference to PRM Class A","Boundary point reference to PRM Class A","A class A boundary point must be less than or equal to 150 m from a permanent reference mark if any of the following is true:\u003Cbr/\u003E\n- the boundary point is a referenced boundary point\u003Cbr/\u003E\n- the boundary point is a referenced boundary mark \u003Cbr/\u003E\n- the boundary point is a referenced height-limited boundary point\u003Cbr/\u003E\n- the boundary point is a boundary mark that is included in a boundary defining a non-primary parcel\u003Cbr/\u003E\n- the boundary point is included in a boundary that defines a non-primary parcel and is not accurately related to a boundary defining an underlying parcel\u003Cbr/\u003E\n- the boundary point is included in a boundary that defines a non-primary parcel that overlies a parcel that is the bed of a stream or the bed of a river or the bed of a lake."
Rule1179,"Boundary point reference to PRM Class B","Boundary point reference to PRM Class B","A class B boundary point must be less than or equal to 500 m from a permanent reference mark if any of the following is true:\u003Cbr/\u003E\n- the boundary point is a referenced boundary point\u003Cbr/\u003E\n- the boundary point is a referenced boundary mark \u003Cbr/\u003E\n- the boundary point is a referenced height-limited boundary point\u003Cbr/\u003E\n- the boundary point is a boundary mark that is included in a boundary defining a non-primary parcel\u003Cbr/\u003E\n- the boundary point is included in a boundary that defines a non-primary parcel and is not accurately related to a boundary defining an underlying parcel\u003Cbr/\u003E\n- the boundary point is included in a boundary that defines a non-primary parcel that overlies a parcel that is the bed of a stream or the bed of a river or the bed of a lake."
Rule1180,"Boundary point reference to PRM Class C","Boundary point reference to PRM Class C","A class C boundary point must be less than or equal to 1000 m from a permanent reference mark if any of the following is true:\u003Cbr/\u003E\n- the boundary point is a referenced boundary point\u003Cbr/\u003E\n- the boundary point is a referenced boundary mark \u003Cbr/\u003E\n- the boundary point is a referenced height-limited boundary point."
Rule1091,"Centre-line easement","Centre-line easement","An existing centre-line easement parcel need not be represented as a polygon or polyhedron only if any of the following is true:\u003Cbr/\u003E\n- the width of the centre-line easement is unknown\u003Cbr/\u003E\n- the centre-line easement is an accepted boundary."
Rule1496,"Certification of CSD","Certification of CSD","A CSD must be certified and dated by a cadastral surveyor as follows:\u003Cbr/\u003E\n"I [name], being a licensed cadastral surveyor, certify that—\u003Cbr/\u003E\n(a) this dataset provided by me and its related survey are accurate, correct, and in accordance with the Cadastral Survey Act 2002 and the Cadastral Survey Rules 2020; and\u003Cbr/\u003E\n(b) the survey was undertaken by me or under my personal direction.""
Rule1128,"Class A Accuracy","Class A Accuracy","An accuracy [relative] between a boundary point and another boundary point must be considered a class A accuracy only if all of the following are true:\u003Cbr/\u003E\n- The accuracy [relative] is less than or equal to 0.06 + (0.00015 * the horizontal distance between the boundary points)\u003Cbr/\u003E\n- The accuracy [relative] is less than or equal to 0.06 + (0.00015 * the slope distance between the boundary points)."
Rule1343,"Class A Boundary","Class A Boundary","A boundary must be considered a class A boundary if any of the following are true:\u003Cbr/\u003E\n- the boundary is in an urban area\u003Cbr/\u003E\n- the boundary is adjoining an urban area\u003Cbr/\u003E\n- the boundary is intended as a result of a cadastral survey to be in an urban area\u003Cbr/\u003E\n- the boundary defines a parcel that is used intensively for commercial, industrial, or residential purposes\u003Cbr/\u003E\n- the boundary defines a parcel that is intended as a result of a cadastral survey to be used intensively for commercial, industrial, or residential purposes."
Rule1348,"Class A Boundary Point","Class A Boundary Point","A boundary point must be considered a class A boundary point if the boundary point is included in a class A boundary."
Rule1131,"Class B Accuracy","Class B Accuracy","An accuracy [relative] between a boundary point and another boundary point must be considered a class B accuracy only if all of the following are true:\u003Cbr/\u003E\n- The accuracy [relative] is less than or equal to 0.30 + (0.0006 * the horizontal distance between the boundary points)\u003Cbr/\u003E\n- The accuracy [relative] is less than or equal to 0.30 + (0.0006 * the slope distance between the boundary points)."
Rule1344,"Class B Boundary","Class B Boundary","A boundary must be considered a class B boundary if the boundary is not any of the following:\u003Cbr/\u003E\n- a class A boundary \u003Cbr/\u003E\n- a class C boundary\u003Cbr/\u003E\n- a class D boundary."
Rule1349,"Class B Boundary Point","Class B Boundary Point","A boundary point must be considered a class B boundary point if all of the following are true:\u003Cbr/\u003E\n- the boundary point is not included in a class A boundary\u003Cbr/\u003E\n- the boundary point is included in a class B boundary."
Rule1363,"Class B non-primary parcel boundary permitted inaccurate relationship to underlying parcel","Class B non-primary parcel boundary permitted inaccurate relationship to underlying parcel","A boundary that defines a non-primary parcel may be not accurately related to another boundary that defines a primary parcel that underlies the non-primary parcel in a cadastral survey only if the primary parcel is not created by that cadastral survey and any of the following are true:\u003Cbr/\u003E\n- the boundary is a class b boundary\u003Cbr/\u003E\n- the other boundary is a class b boundary\u003Cbr/\u003E\n- none of the boundaries that define the primary parcel are accurately defined boundaries."
Rule1133,"Class C Accuracy","Class C Accuracy","An accuracy [relative] between a boundary point and another boundary point must be considered a class C accuracy only if all of the following are true:\u003Cbr/\u003E\n- The accuracy [relative] is less than or equal to 1.00 + (0.003 * the horizontal distance between the boundary points)\u003Cbr/\u003E\n- The accuracy [relative] is less than or equal to 1.00 + (0.003 * the slope distance between the boundary points)."
Rule1345,"Class C Boundary 1","Class C Boundary 1","A boundary that defines a primary parcel must be a class C boundary only if all of the following are true:\u003Cbr/\u003E\n- the boundary is an adopted boundary\u003Cbr/\u003E\n- the boundary is not a class A boundary."
Rule1464,"Class C Boundary 2","Class C Boundary 2","A boundary must not be considered a class C boundary if all of the following are false:\u003Cbr/\u003E\n- the boundary defines a majority successor parcel\u003Cbr/\u003E\n- the boundary defines a new large rural parcel."
Rule1463,"Class C Boundary 3","Class C Boundary 3","A boundary must not be considered a class C boundary if all of the following are false:\u003Cbr/\u003E\n- an accuracy [relative] between boundary points that are included in the boundary is not class B accuracy\u003Cbr/\u003E\n- the boundary defines a parcel that is included in a title that is to remain limited as to parcels\u003Cbr/\u003E\n- the boundary defines a parcel that is included in a title that is to remain a Hawkes Bay interim title."
Rule1350,"Class C Boundary Point","Class C Boundary Point","A boundary point must be considered a class C boundary point if all of the following are true:\u003Cbr/\u003E\n- the boundary point is not included in a class A boundary\u003Cbr/\u003E\n- the boundary point is not included in a class B boundary\u003Cbr/\u003E\n- the boundary point is included in a class C boundary."
Rule1285,"Class C for common marine and coastal area","Class C for common marine and coastal area","A boundary defining a non-primary parcel may be a class C boundary only if the non-primary parcel is within the common marine and coastal area."
Rule1364,"Class C non-primary parcel accuracy 1","Class C non-primary parcel accuracy 1","The relationship between a non-primary parcel and the underlying primary parcel may be inaccurately determined only if all of the following are true:\u003Cbr/\u003E\n- the non-primary parcel is an easement parcel or covenant parcel\u003Cbr/\u003E\n- the boundaries that define the non-primary parcel are class C boundaries."
Rule1347,"Class D Boundary","Class D Boundary","A boundary must be considered a class D boundary if the boundary is an accepted boundary."
Rule1351,"Class D Boundary Point","Class D Boundary Point","A boundary point must be considered a class D boundary point if all of the following are true:\u003Cbr/\u003E\n- the boundary point is not included in a class A boundary\u003Cbr/\u003E\n- the boundary point is not included in a class B boundary\u003Cbr/\u003E\n- the boundary point is not included in a class C boundary\u003Cbr/\u003E\n- the boundary point is included in a class D boundary."
Rule1075,"Complete CSD - movable marginal strip 1","Complete CSD - movable marginal strip 1","A parcel that is a movable marginal strip included in a CSD must be depicted on a title diagram as being contained within the underlying primary parcel of the movable marginal strip."
Rule1239,"Connection - horizontal datum 1","Connection - horizontal datum 1","A boundary point that is included in a boundary that defines a new primary parcel must be connected to a cadastral survey network mark that is less than and equal to 1,000m from the boundary point by a series of vectors that consists only of vectors that are adopted or measured if any of the following is true:\u003Cbr/\u003E\n- the boundary point is a new boundary point\u003Cbr/\u003E\n- the boundary point is a new boundary mark\u003Cbr/\u003E\n- the boundary point is a old boundary mark."
Rule1123,"Connection - horizontal datum 2","Connection - horizontal datum 2","A boundary point that is included in a boundary that defines a new primary parcel may be connected to only cadastral survey network marks that are more than 1,000m from the boundary point only if all of the following are true:\u003Cbr/\u003E\n- there are no existing cadastral survey network marks that are less than or equal to 1,000m from the boundary point\u003Cbr/\u003E\n- the boundary point is connected to the cadastral survey network marks by a series of vectors that consists only of vectors that are adopted or measured\u003Cbr/\u003E\n- the boundary point is a new boundary point or a new boundary mark or a old boundary mark."
